{
  "schema_version": "deepr-expert-value-review-v1",
  "kind": "deepr.eval.expert_value_review",
  "methodology_version": "1.0",
  "rubric_version": "expert-value-rubric-v1",
  "review_set_id": "offline-pilot-temporal-knowledge-graphs",
  "expert_name": "Temporal Knowledge Graphs",
  "blueprint_revision": 1,
  "blueprint_content_hash": "58f9a5ee3b4ee681c7bff91ac6fb2311bc6b1cd7d89affda49f8223d9b1d2e22",
  "source_worlds": [
    {
      "source_world_id": "source-world-1",
      "as_of": "2026-01-01T00:00:00+00:00",
      "predecessor_source_world_id": null,
      "manifest_ref": "worlds/world-1.json",
      "manifest_sha256": "f8f25b1e2ee24b7489698d76897da11c6ad1397e22af0f9b3bbbc0f4d8eafc09",
      "supporting_source_count": 3,
      "distractor_source_count": 1,
      "noise_source_count": 1,
      "introduced_claim_refs": [
        "claim:bi-temporal-axes",
        "claim:as-of-queries",
        "claim:single-timestamp-risk"
      ],
      "invalidated_claim_refs": []
    },
    {
      "source_world_id": "source-world-2",
      "as_of": "2026-02-01T00:00:00+00:00",
      "predecessor_source_world_id": "source-world-1",
      "manifest_ref": "worlds/world-2.json",
      "manifest_sha256": "fff8b5eaac0c3b12c1f654e8d718f1abe311a92bc732e700925c27db2c5b4ea6",
      "supporting_source_count": 4,
      "distractor_source_count": 1,
      "noise_source_count": 1,
      "introduced_claim_refs": [
        "claim:invalidation-preserves-history",
        "claim:single-timestamp-is-wrong",
        "claim:provenance-independent"
      ],
      "invalidated_claim_refs": [
        "claim:single-timestamp-ok"
      ]
    },
    {
      "source_world_id": "source-world-3",
      "as_of": "2026-03-01T00:00:00+00:00",
      "predecessor_source_world_id": "source-world-2",
      "manifest_ref": "worlds/world-3.json",
      "manifest_sha256": "e25933859d07f95e1e42695a8efa45a2eb937393f6d592a900c5623db07c27d0",
      "supporting_source_count": 4,
      "distractor_source_count": 1,
      "noise_source_count": 1,
      "introduced_claim_refs": [
        "claim:product-as-of",
        "claim:no-vendor-lock",
        "claim:provenance-still-required",
        "claim:reject-provenance-drop"
      ],
      "invalidated_claim_refs": []
    }
  ],
  "cases": [
    {
      "acceptance_case_id": "initial-case",
      "source_world_id": "source-world-1",
      "evaluation_role": "initial",
      "expected_abstention": false,
      "observed_outcome": null
    },
    {
      "acceptance_case_id": "retention-case",
      "source_world_id": "source-world-2",
      "evaluation_role": "retention",
      "expected_abstention": false,
      "observed_outcome": null
    },
    {
      "acceptance_case_id": "update-case",
      "source_world_id": "source-world-2",
      "evaluation_role": "update",
      "expected_abstention": false,
      "observed_outcome": null
    },
    {
      "acceptance_case_id": "transfer-case",
      "source_world_id": "source-world-3",
      "evaluation_role": "forward_transfer",
      "expected_abstention": false,
      "observed_outcome": null
    },
    {
      "acceptance_case_id": "hard-negative-case",
      "source_world_id": "source-world-3",
      "evaluation_role": "hard_negative",
      "expected_abstention": true,
      "observed_outcome": null
    }
  ],
  "arm_configurations": [
    {
      "arm": "fresh_research",
      "run_policy_ref": "policies/fresh_research.json",
      "run_policy_sha256": "84d9bb4a1165f902da9931987d25aa5b5317f74ebad5ba42495dab542a75528b",
      "construction_cost_usd": 0.0,
      "maintenance_cost_usd": 0.0,
      "construction_reviewer_minutes": 5.0,
      "maintenance_reviewer_minutes": 0.0
    },
    {
      "arm": "static_history",
      "run_policy_ref": "policies/static_history.json",
      "run_policy_sha256": "6ad16b5df1314c1efe227312edfe5f46d5f49bcebfb2ca47459218303bbeb970",
      "construction_cost_usd": 0.0,
      "maintenance_cost_usd": 0.0,
      "construction_reviewer_minutes": 6.0,
      "maintenance_reviewer_minutes": 0.0
    },
    {
      "arm": "compiled_expert",
      "run_policy_ref": "policies/compiled_expert.json",
      "run_policy_sha256": "ba1d23c56f4a19e4ccba5912d14581583f25ff43c50aece20a94aa454a2034d4",
      "construction_cost_usd": 0.0,
      "maintenance_cost_usd": 0.0,
      "construction_reviewer_minutes": 7.0,
      "maintenance_reviewer_minutes": 0.0
    },
    {
      "arm": "maintained_expert",
      "run_policy_ref": "policies/maintained_expert.json",
      "run_policy_sha256": "28fdcc0f209b8ce62493a58de8b5a97e98572b3d6d16d5aeaba46b6e4868e07c",
      "construction_cost_usd": 0.0,
      "maintenance_cost_usd": 0.0,
      "construction_reviewer_minutes": 8.0,
      "maintenance_reviewer_minutes": 10.0
    }
  ],
  "trials": [
    {
      "acceptance_case_id": "initial-case",
      "arm": "fresh_research",
      "executed_at": "2026-08-04T18:16:03+00:00",
      "run_artifact_ref": "runs/initial-case/fresh_research.json",
      "run_artifact_sha256": "7721fd6a1ce53542e52dbf12fd69d99c11abd1ac46ed869f82001100a34dcee5",
      "answer_artifact_ref": "answers/initial-case/fresh_research.md",
      "answer_artifact_sha256": "c104bdb857c8b6aa6ed529120508a9716c82abaa000d40c6b7c2293804b9a9b4",
      "measurements": {
        "retrieval_cost_usd": 0.0,
        "generation_cost_usd": 0.0,
        "other_execution_cost_usd": 0.0,
        "response_latency_seconds": 0.0,
        "reviewer_minutes": 1.0,
        "update_completed": null,
        "update_latency_hours": null
      },
      "semantic_attestation": {
        "attested_by": "session-operator",
        "attested_at": "2026-08-04T18:16:03+00:00",
        "identity_verified": false,
        "human_authorship_claimed": false,
        "correctness": 4,
        "source_relevance": 4,
        "factual_support": 4,
        "uncertainty_calibration": 3,
        "abstained": false,
        "false_support_observed": false,
        "invalidated_belief_reused": null,
        "negative_transfer_observed": null,
        "retained_correctness": null,
        "forward_transfer_observed": null,
        "rationale": "Session-operator structural rubric for initial-case/fresh_research. Signals bi-temporal=True, history=True, provenance=False, reject=True. identity_verified=false; human_authorship_claimed=false."
      }
    },
    {
      "acceptance_case_id": "initial-case",
      "arm": "static_history",
      "executed_at": "2026-08-04T18:16:03+00:00",
      "run_artifact_ref": "runs/initial-case/static_history.json",
      "run_artifact_sha256": "4e155f765387391b6e2d4d0bff0d1f20738367a8dcdf38da55ba7855ca651c6c",
      "answer_artifact_ref": "answers/initial-case/static_history.md",
      "answer_artifact_sha256": "4c52d6f093e27bb5e8fc92d1944c4b254175c13d78247a3a4ee635ae1b33650a",
      "measurements": {
        "retrieval_cost_usd": 0.0,
        "generation_cost_usd": 0.0,
        "other_execution_cost_usd": 0.0,
        "response_latency_seconds": 0.0,
        "reviewer_minutes": 1.0,
        "update_completed": null,
        "update_latency_hours": null
      },
      "semantic_attestation": {
        "attested_by": "session-operator",
        "attested_at": "2026-08-04T18:16:03+00:00",
        "identity_verified": false,
        "human_authorship_claimed": false,
        "correctness": 4,
        "source_relevance": 4,
        "factual_support": 4,
        "uncertainty_calibration": 3,
        "abstained": false,
        "false_support_observed": false,
        "invalidated_belief_reused": null,
        "negative_transfer_observed": null,
        "retained_correctness": null,
        "forward_transfer_observed": null,
        "rationale": "Session-operator structural rubric for initial-case/static_history. Signals bi-temporal=True, history=True, provenance=False, reject=True. identity_verified=false; human_authorship_claimed=false."
      }
    },
    {
      "acceptance_case_id": "initial-case",
      "arm": "compiled_expert",
      "executed_at": "2026-08-04T18:16:03+00:00",
      "run_artifact_ref": "runs/initial-case/compiled_expert.json",
      "run_artifact_sha256": "cf2ce4b2cec220ca809e611b8c27de0007cffd070c1bbe3d59984c717f76e550",
      "answer_artifact_ref": "answers/initial-case/compiled_expert.md",
      "answer_artifact_sha256": "65840ec77447a2bb791555d9173fda795b28e58ab1ac1c6f8403ba5175828cf1",
      "measurements": {
        "retrieval_cost_usd": 0.0,
        "generation_cost_usd": 0.0,
        "other_execution_cost_usd": 0.0,
        "response_latency_seconds": 0.0,
        "reviewer_minutes": 1.0,
        "update_completed": null,
        "update_latency_hours": null
      },
      "semantic_attestation": {
        "attested_by": "session-operator",
        "attested_at": "2026-08-04T18:16:03+00:00",
        "identity_verified": false,
        "human_authorship_claimed": false,
        "correctness": 4,
        "source_relevance": 4,
        "factual_support": 4,
        "uncertainty_calibration": 3,
        "abstained": false,
        "false_support_observed": false,
        "invalidated_belief_reused": null,
        "negative_transfer_observed": null,
        "retained_correctness": null,
        "forward_transfer_observed": null,
        "rationale": "Session-operator structural rubric for initial-case/compiled_expert. Signals bi-temporal=True, history=True, provenance=False, reject=True. identity_verified=false; human_authorship_claimed=false."
      }
    },
    {
      "acceptance_case_id": "initial-case",
      "arm": "maintained_expert",
      "executed_at": "2026-08-04T18:16:03+00:00",
      "run_artifact_ref": "runs/initial-case/maintained_expert.json",
      "run_artifact_sha256": "7d21928ccd2c3749352a1644640356a68f1b9978705d52aab1f3197ea10bd740",
      "answer_artifact_ref": "answers/initial-case/maintained_expert.md",
      "answer_artifact_sha256": "34152f7b65ea17a3371d73a2b0a70cfa1b681dd2d698d7eca5aa81cd53a3d8ca",
      "measurements": {
        "retrieval_cost_usd": 0.0,